"","jpm$text","text_clean"
"13504","And now let's focus on the big city corruption: # AskJPM.","And now let's focus on the big city corruption: "
"13505","Hey @ JPMorgan, why are you trying to destroy my community by throwing neighbors out of their homes instead of negotiating? # AskJPM # JPM","Hey  why are you trying to destroy my community by throwing neighbors out of their homes instead of negotiating?  "
"13506","2 part question: Is gold still a afe haven and what would you say is air value for Obamacare? # AskJPM","2 part question: Is gold still a afe haven and what would you say is air value for Obamacare? "
"13507","How much does previous criminal activity count in favor of a job candidate? # AskJPM","How much does previous criminal activity count in favor of a job candidate? "
"13508","Apparently not. RT @ jacklord I'm sure # AskJPM is going to be a PR triumph","Apparently not.   I'm sure  is going to be a PR triumph"
"13509","How much have you profited off Jaymie's foreclosure, including the 5x she's paid for her home? # AskJPM # jaymieshouse http://www.occupyhomesmn.org/electiondayraid","How much have you profited off Jaymie's foreclosure, including the 5x she's paid for her home?   "
"13510","@ chris_gould89 what's the highest denomination note you've used as toilet paper? # AskJPM"," what's the highest denomination note you've used as toilet paper? "
"13511","I'm a young start-up investment bank who just did his first foreclosure. Do you have any mentoring or career advice? # AskJPM","I'm a young start-up investment bank who just did his first foreclosure. Do you have any mentoring or career advice? "
"13512","# AskJPM How did JPMorgan vote on last year's # Nacha proposal to move to same-day # ACH settlement? http://bit.ly/1hFVVw5 # Payments"," How did JPMorgan vote on last year's  proposal to move to same-day  settlement? "
"13513","Have any questions for J.P. Morgan? # AskJPM http://dld.bz/cUefM","Have any questions for J.P. Morgan?  "
"13514","What's it like working with Mexican drug cartels? Do they tip? # AskJPM","What's it like working with Mexican drug cartels? Do they tip? "
"13515","# AskJPM why does Blythe and Jamie naked short silver ETFs for the fed??"," why does Blythe and Jamie naked short silver ETFs for the fed??"
"13516","Reading the # AskJPM Twitter feed makes it seem JPM put a ick me sticker on its back when it rolled out that hashtag.","Reading the  Twitter feed makes it seem JPM put a ick me sticker on its back when it rolled out that hashtag."
"13517","Watching # askJPM unfolding...","Watching  unfolding..."
"13518","# AskJPM what's the easiest way to leave a nondescript van in your underground parking"," what's the easiest way to leave a nondescript van in your underground parking"
"13519","# AskJPM Is it true that, while you don't always spit on poor people, when you do, you have perfect aim?"," Is it true that, while you don't always spit on poor people, when you do, you have perfect aim?"
"13520","Have any questions for J.P. Morgan? # AskJPM http://dlvr.it/4K1jcc","Have any questions for J.P. Morgan?  "
"13521","Does it feel better paying the biggest bank fines in history so far, or did the satisfaction of the crimes outweigh the fines? # AskJPM","Does it feel better paying the biggest bank fines in history so far, or did the satisfaction of the crimes outweigh the fines? "
"13522","RT @ amy10506: Did you have a specific number of people's lives you needed to ruin before you considered your model a success? # AskJPM","  Did you have a specific number of people's lives you needed to ruin before you considered your model a success? "
"13523","If your company donates money to a charity how do I know those funds were not from an illegal foreclosure? # AskJPM # ows @ OccupyHomesMN","If your company donates money to a charity how do I know those funds were not from an illegal foreclosure?   "
"13524","RT @ Talking_Monkeys: Is it true a young Satan would cower under the covers at night fearing there was a Jamie Dimon under the bed? # AskJPM","  Is it true a young Satan would cower under the covers at night fearing there was a Jamie Dimon under the bed? "
"13525","Are you a Samantha, Carrie, Miranda or Charlotte? I tend to think you're a Samantha. Do you agree? # AskJPM","Are you a Samantha, Carrie, Miranda or Charlotte? I tend to think you're a Samantha. Do you agree? "
"13526","RT @felixgilman would you say this is going as well as you planned, or even better # AskJPM","  would you say this is going as well as you planned, or even better "
"13527","Ladies and Gentlemen, the Snarkpocalypse is upon us. Brought about by this: # AskJPM","Ladies and Gentlemen, the Snarkpocalypse is upon us. Brought about by this: "
"13528","Not sure the # AskJPM hashtag is going exactly as planned for $ JPM's social media team. See previous tweet. Thanks @ taralach for flagging","Not sure the  hashtag is going exactly as planned for $ JPM's social media team. See previous tweet. Thanks  for flagging"
"13529","Can my ma and I move into one of yer second homes after you evict us? # AskJPM","Can my ma and I move into one of yer second homes after you evict us? "
"13530","RT @ occupywallst: Ever wish you could give JP Morgan/Chase a piece of your mind? Check out the hashtag # AskJPM right now.","  Ever wish you could give JP Morgan/Chase a piece of your mind? Check out the hashtag  right now."
"13531","would you say this is going as well as you planned, or even better # AskJPM","would you say this is going as well as you planned, or even better "
"13532","If youd like a Wall St related chuckle, check out # AskJPM, for which at least one member of @ jpmorgan's crack team of PR dudes lost his job","If youd like a Wall St related chuckle, check out  for which at least one member of  crack team of PR dudes lost his job"
"13533","ñ @ HeatherFaison: 1. Look up # AskJPM 2. Laugh. Loudly.î","ü¾Œ–˜¼  1. Look up  2. Laugh. Loudly.ü¾™–”¼"
"13534","# AskJPM why did u think this would be a good idea"," why did u think this would be a good idea"
"13535","This does not seem like the most ... well-thought-out social media experiment RT @ LizMoyer # askJPM is an interesting read","This does not seem like the most ... well-thought-out social media experiment    is an interesting read"
"13536","IF I SAID OU HAVE A GREAT BODY WOULD YOU HOLD IT AGAINST ME? # AskJPM","IF I SAID OU HAVE A GREAT BODY WOULD YOU HOLD IT AGAINST ME? "
"13537","Adventures in PR... RT @ kevinroose: Would you rather negotiate with 1 horse-sized Eric Holder, or 100 duck-sized Eric Holders? # AskJPM","Adventures in PR...   Would you rather negotiate with 1 horse-sized Eric Holder, or 100 duck-sized Eric Holders? "
"13538","Ever wish you could give JP Morgan/Chase a piece of your mind? Check out the hashtag # AskJPM right now.","Ever wish you could give JP Morgan/Chase a piece of your mind? Check out the hashtag  right now."
"13539","Where do babies come from? # AskJPM","Where do babies come from? "
"13540","# AskJPM ... oh boy ..."," ... oh boy ..."
"13541","Do you believe in crime and punishment? # AskJPM # occupy # SergiosHouse . @ jpmorgan","Do you believe in crime and punishment?    . "
"13542","# AskJPM fail..."," fail..."
"13543","@ alexisgoldstein @ stacyherbert @ jpmorgan We should not be rude and include @ tonyblairoffice in this debate # AskJPM come on Tone, how much?","   We should not be rude and include  in this debate  come on Tone, how much?"
"13544","There's no such thing as bad publicity? RT @ kevinroose Bet the JPMorgan PR team is less than thrilled with how # AskJPM is going.","There's no such thing as bad publicity?   Bet the JPMorgan PR team is less than thrilled with how  is going."
"13545","Why did you have Sergio's utilities cut after promising to sell his house back at fair market value? # AskJPM # sergioshouse","Why did you have Sergio's utilities cut after promising to sell his house back at fair market value?  "
"13546","# askJPM is an interesting read"," is an interesting read"
"13547","Is Jamie Dimon's smile washable? # AskJPM","Is Jamie Dimon's smile washable? "
"13548","1. Look up # AskJPM 2. Laugh. Loudly.","1. Look up  2. Laugh. Loudly."
"13549","With everything you now know; the suffering, expense, lives ruined all for YOUR profits... You'd do it again, right? # AskJPM","With everything you now know; the suffering, expense, lives ruined all for YOUR profits... You'd do it again, right? "
"13550","Ouch. But what *were* they thinking? RT @ rachelsedelman: If you feel like a failure, imagine being the person who came up with # AskJPM","Ouch. But what *were* they thinking?   If you feel like a failure, imagine being the person who came up with "
"13551","Should we assume # BerateJPM ht was already taken? @ kevinroose 4m Bet the JPMorgan PR team is less than thrilled with how # AskJPM is going.","Should we assume  ht was already taken?  4m Bet the JPMorgan PR team is less than thrilled with how  is going."
"13552","Is it true a young Satan would cower under the covers at night fearing there was a Jamie Dimon under the bed? # AskJPM","Is it true a young Satan would cower under the covers at night fearing there was a Jamie Dimon under the bed? "
"13553","RT @ matt_levine: Do you like puppies? If you had a puppy, what would you name him? # AskJPM","  Do you like puppies? If you had a puppy, what would you name him? "
"13554","How do you decide who to forclose on? Darts or a computer program? # AskJPM","How do you decide who to forclose on? Darts or a computer program? "
"13555","Yo @ YourAnonNews and everyone tweet out using the # AskJPM hashtag! I'm concerned Voldemort is running the show there...Confirm/Deny? # ows","Yo  and everyone tweet out using the  hashtag! I'm concerned Voldemort is running the show there...Confirm/Deny? "
"13556","@ alexisgoldstein @ stacyherbert @ jpmorgan What's the name of the Trust JPM have set up for Tony Blair? # AskJPM Forgotten have we?","   What's the name of the Trust JPM have set up for Tony Blair?  Forgotten have we?"
"13557","Worth browsing. Wowza - RT @ kevinroose: Bet the JPMorgan PR team is less than thrilled with how # AskJPM is going.","Worth browsing. Wowza -   Bet the JPMorgan PR team is less than thrilled with how  is going."
"13558","Does Jamie Dimon give off a cannibal vibe or something? A lot of accusations flying on # AskJPM","Does Jamie Dimon give off a cannibal vibe or something? A lot of accusations flying on "
"13559","piling onto @ alexisgoldstein's last Q, do you have a target rate of recidivism for execs before you promote them? # AskJPM","piling onto  last Q, do you have a target rate of recidivism for execs before you promote them? "
"13560","If you feel like a failure, imagine being the person who came up with # AskJPM","If you feel like a failure, imagine being the person who came up with "
"13561","When are JPM gonna stop manipulate the silvermarket? # AskJPM","When are JPM gonna stop manipulate the silvermarket? "
"13562","What was JP Morgan thinking with this # AskJPM hashtag?","What was JP Morgan thinking with this  hashtag?"
"13563","@ jpmorgan Is it true PM stands for Just Pay More # AskJPM"," Is it true PM stands for Just Pay More "
"13564","@ alexisgoldstein @ stacyherbert @ jpmorgan How much did you pay Tony Blair for Iraq War? You know, 3 months after. # AskJPM","   How much did you pay Tony Blair for Iraq War? You know, 3 months after. "
"13565","@alyssa011968 this feels like advise :) check out the # AskJPM tag"," this feels like advise :) check out the  tag"
"13566","Do you like puppies? If you had a puppy, what would you name him? # AskJPM","Do you like puppies? If you had a puppy, what would you name him? "
"13567","Will the number of people who eventually starve to death due to JP Morgan fraud exceed holocaust numbers, or greatly exceed them? # AskJPM","Will the number of people who eventually starve to death due to JP Morgan fraud exceed holocaust numbers, or greatly exceed them? "
"13568","Did you know that the hero of IT'S A WONDERFUL LIFE is actually George Bailey, and NOT Mr. Potter? Pretty crazy amirite? # AskJPM","Did you know that the hero of IT'S A WONDERFUL LIFE is actually George Bailey, and NOT Mr. Potter? Pretty crazy amirite? "
"13569","Have any questions for J.P. Morgan? # AskJPM http://feedproxy.google.com/~r/Maxkeisercom/~3/8ipLI8OWXPM/ ƒ","Have any questions for J.P. Morgan?  ü¾Œ³ ¼"
"13570","mm. Maybe we should get us one o' them--what you call 'em? 'Socialized Media Managers?' -- @ jpmorgan, after seeing results of # AskJPM","mm. Maybe we should get us one o' them--what you call 'em? 'Socialized Media Managers?' --  after seeing results of "
"13571","Are you proud of being one of the largest welfare recipients on the planet? # AskJPM","Are you proud of being one of the largest welfare recipients on the planet? "
"13572","Doh! # AskJPM almost like that # askjustinladyquestions but not.","Doh!  almost like that  but not."
"13573",". @ JPMorgan, did you short # BearSterns stocks to crash them yourself, or just pick up the pieces to patch your balance sheet after? # AskJPM",".  did you short  stocks to crash them yourself, or just pick up the pieces to patch your balance sheet after? "
"13574","ñ @ amy10506: Every time another person loses their home to an illegal foreclosure, does a bell ring? # AskJPMî","ü¾Œ–˜¼  Every time another person loses their home to an illegal foreclosure, does a bell ring? "
"13575","When Jamie Dimon eats babies are they served rare? I understand anything above medium-rare is considered gauche. # AskJPM","When Jamie Dimon eats babies are they served rare? I understand anything above medium-rare is considered gauche. "
"13576","Have any questions for J.P. Morgan? # AskJPM http://dlvr.it/4K1cMn # occupysilver","Have any questions for J.P. Morgan?  "
"13577","Why do you think its ok to outright lie, cheat and steal? # AskJPM # occupy # SergiosHouse . @ jpmorgan","Why do you think its ok to outright lie, cheat and steal?    . "
"13578","Hey, @ jpmorgan: What's it like knowing that you've escaped punishment for securities fraud again & again? # AskJPM http://other98.com/dont-negotiate-with-chase-prosecute-them/ ƒ","Hey,  What's it like knowing that you've escaped punishment for securities fraud again & again?  ü¾Œ³ ¼"
"13579","Every time another person loses their home to an illegal foreclosure, does a bell ring? # AskJPM","Every time another person loses their home to an illegal foreclosure, does a bell ring? "
"13580","Have you ever wondered what evil looked like in the world? # AskJPM # jailbankers # SergiosHouse @ jpmorgan","Have you ever wondered what evil looked like in the world?    "
"13581","@ alexisgoldstein @ stacyherbert @ jpmorgan Are you first in line forTony's butt hole? # AskJPM # WhosDaManWhosDaBitch","   Are you first in line forTony's butt hole?  "
"13582","MT @ ddayen: Do you also get mixed up over what fed agency wants to sue you for what illegal conduct? Do you need spreadsheet help? # AskJPM","MT  Do you also get mixed up over what fed agency wants to sue you for what illegal conduct? Do you need spreadsheet help? "
"13583","So @ jpmorgan really created a hash tag ( # AskJPM) where anyone can tweet them ANY question? I'm guessing they're regretting that about now.","So  really created a hash tag (  where anyone can tweet them ANY question? I'm guessing they're regretting that about now."
"13584","@ OccupyWallSt Have you seen the # AskJPM thread?"," Have you seen the  thread?"
"13585","Have any questions for J.P. Morgan? # AskJPM http://po.st/XrqKEb via @ maxkeiser","Have any questions for J.P. Morgan?  via "
"13586","If it came out Jamie Dimon had a propensity for eating Irish children, would you fire him? What if he's still  good earner? # AskJPM","If it came out Jamie Dimon had a propensity for eating Irish children, would you fire him? What if he's still  good earner? "
"13587","@ alexisgoldstein @ stacyherbert @ jpmorgan Hows it feel being the Worlds Criminal Bank? # AskJPM # 1BillionDollars # Banksters # Wankers","   Hows it feel being the Worlds Criminal Bank?    "
"13588","Is it the ability to throw anyone out of their home that drives you, or just the satisfaction that you know you COULD do it? # AskJPM","Is it the ability to throw anyone out of their home that drives you, or just the satisfaction that you know you COULD do it? "
"13589","How many homeless people did you create in '08? # AskJPM","How many homeless people did you create in '08? "
"13590","[maxkeiser] Have any questions for J.P. Morgan? # AskJPM http://n0.gd/1bpf3G5","[maxkeiser] Have any questions for J.P. Morgan?  "
"13591","@ alexisgoldstein @ stacyherbert @ jpmorgan @ StrikeDebt @ OccupyWallSt @ OccupyWallStNYC Does Blair do his freak show with Mandy at AGMs # AskJPM","      Does Blair do his freak show with Mandy at AGMs "
"13592","Have any questions for J.P. Morgan? # AskJPM http://ift.tt/1aq2JHX # OccupyWB # OccupyIMF http://www.noworldbank.com # Usury # LiborGate # DIYMoney","Have any questions for J.P. Morgan?      "
"13593","Have any questions for J.P. Morgan? # AskJPM http://dlvr.it/4K1V4T","Have any questions for J.P. Morgan?  "
"13594","Do you also get mixed up over what federal agency wants to sue you for what illegal conduct? Do you need spreadsheet help? # AskJPM","Do you also get mixed up over what federal agency wants to sue you for what illegal conduct? Do you need spreadsheet help? "
"13595","Does that teflon skin itch? # AskJPM","Does that teflon skin itch? "
"13596","@ alexisgoldstein @ stacyherbert @ jpmorgan @ StrikeDebt @ OccupyWallSt @ OccupyWallStNYC Who's knob is Tony Blair sucking at JPM # AskJPM","      Who's knob is Tony Blair sucking at JPM "
"13597","Sounds like this --> # AskJPM was created for @ pareene","Sounds like this -->  was created for "
"13598","Will this new settlement help keep wrongfully foreclosed people like Jaymie and Sergio in their homes or just provide paltry checks? # AskJPM","Will this new settlement help keep wrongfully foreclosed people like Jaymie and Sergio in their homes or just provide paltry checks? "
"13599","# AskJPM Question: Is Jamie Dimon still regularly having sex with a goat? Thank you!"," Question: Is Jamie Dimon still regularly having sex with a goat? Thank you!"
"13600","Did you have a specific number of people's lives you needed to ruin before you considered your business model a success? # AskJPM","Did you have a specific number of people's lives you needed to ruin before you considered your business model a success? "
"13601","At what number of Billions of Dollars in fines will it no longer be profitable to run your criminal enterprise? # askjpm","At what number of Billions of Dollars in fines will it no longer be profitable to run your criminal enterprise? "
"13602","Crime: A) Totally pays, just look at us B) Boy I don't know C) If a market-maker does it that means it's not illegal # AskJPM","Crime: A) Totally pays, just look at us B) Boy I don't know C) If a market-maker does it that means it's not illegal "
"13603","How exactly do your hurt feelings prevent job/wage growth? # AskJPM","How exactly do your hurt feelings prevent job/wage growth? "
"13604","@ alexisgoldstein assuming you'll get on board soon with # AskJPM"," assuming you'll get on board soon with "
"13605","Did you not realize that The Smartest Guys In The Room was a cautionary tale, not a blueprint for mass theft? # AskJPM http://www.ghostinthemachine.net/worse-than-enron-shrug/ ƒ","Did you not realize that The Smartest Guys In The Room was a cautionary tale, not a blueprint for mass theft?  ü¾Œ³ ¼"
"13606","Have your highly-paid underlings learned not to take notes during a criminal f**king conspiracy? # AskJPM http://www.ghostinthemachine.net/dimon-meet-coop/ ƒ","Have your highly-paid underlings learned not to take notes during a criminal f**king conspiracy?  ü¾Œ³ ¼"
"13607","Isn't it better for the economy having a bunch of jobs paying $50,000 to $60,000 a year than one making 7, 8 or 9 figures? # AskJPM","Isn't it better for the economy having a bunch of jobs paying $50,000 to $60,000 a year than one making 7, 8 or 9 figures? "
"13608","Do you have a secret jail in your offices so your executives get at least one chance to see the inside of one? # AskJPM","Do you have a secret jail in your offices so your executives get at least one chance to see the inside of one? "
"13609","Will the firm explore new markets, like selling candy-backed securities to babies w/o disclosing the lack of chocolate in the bonds? # AskJPM","Will the firm explore new markets, like selling candy-backed securities to babies w/o disclosing the lack of chocolate in the bonds? "
"13610","Do you have an org chart that's perfectly analogous to the criminal underworld - capo, made man - or do you just wing it? # AskJPM","Do you have an org chart that's perfectly analogous to the criminal underworld - capo, made man - or do you just wing it? "
"13611","They're doing an # AskJPM Twitter Q&A? Oh, I might be able to scrounge up a few questions.","They're doing an  Twitter Q&A? Oh, I might be able to scrounge up a few questions."
"13612","# AskJPM Does Jimmy Lee really cheat at golf? http://bit.ly/18sWnEt (asking for a friend @ dan_freed)"," Does Jimmy Lee really cheat at golf? (asking for a friend "
"13613","$ JPM VC Jimmy Lee is taking over @ JPMorgan on 11/14 at 1pm ET. Tweet Qs using # AskJPM & learn more about him here: http://jpm.com/x/a/NFPV4Fj","$ JPM VC Jimmy Lee is taking over  on 11/14 at 1pm ET. Tweet Qs using  & learn more about him here: "
"13614","Tomorrow at 1pm ET $ JPM Vice Chairman Jimmy Lee takes over @ JPMorgan to answer your questions for 1 hour. Tweet your Q early using # AskJPM","Tomorrow at 1pm ET $ JPM Vice Chairman Jimmy Lee takes over  to answer your questions for 1 hour. Tweet your Q early using "
"13615","@ jpmorgan: Wonder what it takes to be a Sr. Exec at a global company? # AskJPMÍs Jimmy Lee. @the_jaranamo @ jpmorgan on Nov. 14 at 1pm ET"," Wonder what it takes to be a Sr. Exec at a global company?  Jimmy Lee.   on Nov. 14 at 1pm ET"
"13616","# Students: Wonder what it takes to be a Sr. Exec at a global company? # AskJPMÍs Jimmy Lee. HeÍs taking over @ jpmorgan on Nov. 14 at 1pm ET"," Wonder what it takes to be a Sr. Exec at a global company?  Jimmy Lee. Heü¾™†Œ¼s taking over  on Nov. 14 at 1pm ET"
"13617","In 2 days $ JPM's Jimmy Lee, takes over @ JPMorgan to answer your questions. Use # AskJPM to submit your question early http://jpm.com/x/a/NFPV4Fj","In 2 days $ JPM's Jimmy Lee, takes over  to answer your questions. Use  to submit your question early "
"13618","$ JPM VC Jimmy Lee will do his 1st Q&A on his experiences, leadership & # CareerAdvice at 1pm ET on 11/14. Tweet questions early using # AskJPM","$ JPM VC Jimmy Lee will do his 1st Q&A on his experiences, leadership &  at 1pm ET on 11/14. Tweet questions early using "
"13619","Great brand approach RT @ jpmorgan: # TwitterTakeover: On 11/14 $ JPM Vice Chairman, Jimmy Lee, takes over @ JPMorgan to answer q's. Use # AskJPM","Great brand approach    On 11/14 $ JPM Vice Chairman, Jimmy Lee, takes over  to answer q's. Use "
"13620","What do you consider the most important part of your job? # AskJPM","What do you consider the most important part of your job? "
"13621","did i miss # askJPM? @ ErichTimmerman","did i miss  "
"13622","# AskJPM What is the maximum amount of material wealth that a person can accumulate and still be allowed into Heaven?"," What is the maximum amount of material wealth that a person can accumulate and still be allowed into Heaven?"
"13623","@ jpmorgan Oh, come on. I was teasing! # AskJPM :)"," Oh, come on. I was teasing!  :)"
"13624","@ jpmorgan Is it true PM stands for Just Pay More # AskJPM"," Is it true PM stands for Just Pay More "
"13625","ItÍs a # TwitterTakeover: On 11/14 $ JPM Vice Chairman, Jimmy Lee, takes over @ JPMorgan to answer questions. Use # AskJPM to tweet a question.","Itü¾™†Œ¼s a  On 11/14 $ JPM Vice Chairman, Jimmy Lee, takes over  to answer questions. Use  to tweet a question."
"13626","On Nov. 14 at 1pm ET $ JPM Vice Chairman, Jimmy Lee will host a Q&A ? tweet your questions early using # AskJPM","On Nov. 14 at 1pm ET $ JPM Vice Chairman, Jimmy Lee will host a Q&A ? tweet your questions early using "
"13627","@ jpmorgan Has social media changed the way $ JPM does business / communicates? How many people on $ JPM's social media team? # AskJPM"," Has social media changed the way $ JPM does business / communicates? How many people on $ JPM's social media team? "
"13628","$ JPM Vice Chairman Jimmy Lee is taking over @ JPMorgan on 11/14 at 1pm ET. Use # AskJPM for a chance to have him answer your question.","$ JPM Vice Chairman Jimmy Lee is taking over  on 11/14 at 1pm ET. Use  for a chance to have him answer your question."
"13629","$ JPM VC Jimmy Lee will do his 1st Q&A on his experiences, leadership & career advice at 1pm ET on 11/14. Tweet questions using # AskJPM","$ JPM VC Jimmy Lee will do his 1st Q&A on his experiences, leadership & career advice at 1pm ET on 11/14. Tweet questions using "
"13630","On Nov. 14 at 1pm ET $ JPM Vice Chairman, Jimmy Lee will host a Q&A ? tweet your questions early using # AskJPM","On Nov. 14 at 1pm ET $ JPM Vice Chairman, Jimmy Lee will host a Q&A ? tweet your questions early using "
"13631","He's been a part of Wall St.'s biggest deals @ Dell, @ GM. $ JPM Vice Chairman Jimmy Lee takes over @ JPMorgan on 11/14 # AskJPM","He's been a part of Wall St.'s biggest deals   $ JPM Vice Chairman Jimmy Lee takes over  on 11/14 "
"13632","One week from today a $ JPM exec takes over @ JPMorgan to answer your questions on leadership & life. Tweet your questions to us using # AskJPM","One week from today a $ JPM exec takes over  to answer your questions on leadership & life. Tweet your questions to us using "
