"","jpm$text","text_clean"
"13218","How much panache does it take to dot an 'i', cross a 't', and say hus I willed it at the world largest banking bureaucracy? # AskJPM","How much panache does it take to dot an 'i', cross a 't', and say hus I willed it at the world largest banking bureaucracy? "
"13219","What else could US do with $13 billion/yr spent on tax loophole for hedge fund managers? # askjpm","What else could US do with $13 billion/yr spent on tax loophole for hedge fund managers? "
"13220","Would you mind using lube next time you fuck us? Or at least tell us we're pretty? # AskJPM","Would you mind using lube next time you fuck us? Or at least tell us we're pretty? "
"13221","I hope they answer this one RT @ kevinroose Would you rather negotiate with 1 horse-sized Eric Holder or 100 duck-sized Eric Holders? # AskJPM","I hope they answer this one   Would you rather negotiate with 1 horse-sized Eric Holder or 100 duck-sized Eric Holders? "
"13222","If Goldman is the vampire squid does that mean you're a shifter squid or a weresquid? Probably not a fairy squid # AskJPM","If Goldman is the vampire squid does that mean you're a shifter squid or a weresquid? Probably not a fairy squid "
"13223","Have any questions for J.P. Morgan? # AskJPM http://feedproxy.google.com/~r/Maxkeisercom/~3/8ipLI8OWXPM/ ƒ","Have any questions for J.P. Morgan?  ü¾Œ³ ¼"
"13224",".@vandermy gave me a heads up about the # AskJPM hashtag. Gold, pure gold.",". gave me a heads up about the  hashtag. Gold, pure gold."
"13225","Mr. Dimon, which of your abject failures are you proudest of? http://www.nakedcapitalism.com/2012/07/michael-crimmins-why-hasnt-jamie-dimon-been-fired-by-his-board-yet.html ƒ # ASKJPM","Mr. Dimon, which of your abject failures are you proudest of? ü¾Œ³ ¼ "
"13226","# AskJPM Could you break out EBT processing income from EPS?"," Could you break out EBT processing income from EPS?"
"13227","Where does # AskJPM fall among your company's smart, sensible business strategies?","Where does  fall among your company's smart, sensible business strategies?"
"13228","Dear # AskJPM: Cubs or Sox? Yanks or Mets?Less filling or astes great? Support your answers with concrete examples.","Dear  Cubs or Sox? Yanks or Mets?Less filling or astes great? Support your answers with concrete examples."
"13229","# AskJPM when will paper silver collapse? Let's get the show on the road."," when will paper silver collapse? Let's get the show on the road."
"13230","Do you sometimes feel like prostitutes? # AskJPM","Do you sometimes feel like prostitutes? "
"13231","# AskJPM Be honest...OFAC aren't rules, they're more guidelines, right?"," Be honest...OFAC aren't rules, they're more guidelines, right?"
"13232","So is @ jpmorgan going to see the funny side of the # AskJPM debacle or quickly fire some ppl? I'm thinking the latter...","So is  going to see the funny side of the  debacle or quickly fire some ppl? I'm thinking the latter..."
"13233","@ EDKrudy I don't know that. (catapulted into space) # AskJPM"," I don't know that. (catapulted into space) "
"13234","Quick! Follow @corpounreal before they finish their # AskJPM","Quick! Follow  before they finish their "
"13235","Q: When did the realization the London Whale trades had escalated beyond your control feel the same as this spiraling PR disaster? # AskJPM","Q: When did the realization the London Whale trades had escalated beyond your control feel the same as this spiraling PR disaster? "
"13236","@ jpmorgan which financial crime are you most proud of? Bribery (Jefferson county), fraud, rigging markets or money laundering # AskJPM"," which financial crime are you most proud of? Bribery (Jefferson county), fraud, rigging markets or money laundering "
"13237","What does it look like when a Twitter experiment goes wrong? # AskJPM","What does it look like when a Twitter experiment goes wrong? "
"13238","Badgerñ @ SconsetCapital: If you could be any kind of animal, what would you be? # AskJPMî","Badgerü¾Œ–˜¼  If you could be any kind of animal, what would you be? "
"13239","Does Hank *really* like Tim? C'mon, I won't tell them what you said. # AskJPM","Does Hank *really* like Tim? C'mon, I won't tell them what you said. "
"13240","# AskJPM as virtual stockade and tomato pelting show. Get your virtual rage on, then continue in real helplessness. Well played, @ jpmorgan."," as virtual stockade and tomato pelting show. Get your virtual rage on, then continue in real helplessness. Well played, "
"13241","was Washington Mutual buried alive? open the coffin so we can look for fingernail scratches... # AskJPM","was Washington Mutual buried alive? open the coffin so we can look for fingernail scratches... "
"13242","Take a little break and check out # AskJPM on Twitter. Hilarious!","Take a little break and check out  on Twitter. Hilarious!"
"13243","Jamie, we know you're richer than that one analyst, but are you richer than ALL of the analysts? # AskJPM","Jamie, we know you're richer than that one analyst, but are you richer than ALL of the analysts? "
"13244","# AskJPM Does the Federal Reserve's reverse-repo facility reduce the expectations that the...uh...oh, whom I kidding: What's wrong with you?"," Does the Federal Reserve's reverse-repo facility reduce the expectations that the...uh...oh, whom I kidding: What's wrong with you?"
"13245","Do you think the guy working on # AskGoldmanSachs just crossed it off his to-do list? # AskJPM","Do you think the guy working on  just crossed it off his to-do list? "
"13246","At what date will you be able to securitize your commit fraud pay the fines business model? # AskJPM","At what date will you be able to securitize your commit fraud pay the fines business model? "
"13247","Can I redeem my reward points in Renminbi? # AskJPM","Can I redeem my reward points in Renminbi? "
"13248","# AskJPM RT @ zerohedge: Wait, shouldn't Tepco's ontainment building NOT be leaking?","   Wait, shouldn't Tepco's ontainment building NOT be leaking?"
"13249","How much are you paying your social media manager? # AskJPM","How much are you paying your social media manager? "
"13250","@ davidgaffen:What does Marcellus Wallace look like? # AskJPM do the american people look like a bitch? Then why would you fuck us like one?"," does Marcellus Wallace look like?  do the american people look like a bitch? Then why would you fuck us like one?"
"13251","From the social media Gods: # AskJPM anything you want, now trending on Twitter.","From the social media Gods:  anything you want, now trending on Twitter."
"13252","ñ @ ExtraDividends: So are you still manipulating the prices of Silver? Did you try to kill Andrew Maguire? # AskJPM","ü¾Œ–˜¼  So are you still manipulating the prices of Silver? Did you try to kill Andrew Maguire? "
"13253","# AskJPM, I have 100 SLV units, where & how can I convert it into real AG (Silver)?"," I have 100 SLV units, where & how can I convert it into real AG (Silver)?"
"13254","# AskJPM why US citz w/ a foreign held account, said account is not FDIC insured."," why US citz w/ a foreign held account, said account is not FDIC insured."
"13255","GO=>http://www.google.de/url?sa=t&rct=j&q=&esrc=s&frm=1&source=web&cd=2&cad=rja&ved=0CDQQFjAB&url=http%3A%2F%2Fwww.bestfollowers.org%2F&ei=jBIhUru6H8aQhQeOqYDAAQ&usg=AFQjCNF-SxG8PKtvDVRb3XHED3NHCY3TYw&sig2=7L24W6xHQ-_noGVLB9aEqQ&bvm=bv.51495398,d.Yms&SBRn&tharwatElnakeeb ƒ # CookieDance, # AskJPM, # MentionATrueFriend, # UKTVNeedsOutlander, # UDMundial,New Zealand,Iri","GO=>ü¾Œ³ ¼      Zealand,Iri"
"13256","Oh my lord, the # askjpm session. Will go down as case study in corporate use of social media.","Oh my lord, the  session. Will go down as case study in corporate use of social media."
"13257","Are you less evil or just not as smart as Goldman Sachs? # askJPM","Are you less evil or just not as smart as Goldman Sachs? "
"13258","I'm really hoping Jimmy Lee DOES show up tomorrow! # askJPM","I'm really hoping Jimmy Lee DOES show up tomorrow! "
"13259","@ cbk_chi Are you talking about the bankster cockroaches (because they all are) or do they have the insect companions there too # askJPM"," Are you talking about the bankster cockroaches (because they all are) or do they have the insect companions there too "
"13260","Who did you like doing business with more MF Global or Bernie Madoff? # AskJPM","Who did you like doing business with more MF Global or Bernie Madoff? "
"13261","# AskJPM How do you criminal, greedy rip offs sleep at night? Hopefully the government will deal with you soon and some will be serving time."," How do you criminal, greedy rip offs sleep at night? Hopefully the government will deal with you soon and some will be serving time."
"13262","Are you relieved that credit ratings services are so inept, or would your billables be even higher if you faced competent scrutiny? # AskJPM","Are you relieved that credit ratings services are so inept, or would your billables be even higher if you faced competent scrutiny? "
"13263","GO=>http://www.linklite.info/followcrazy?stdC1SMw8y&PHlindinho1 ƒ ?RT?FOLLOWME?IFOLLOWYOU # CookieDance, # AskJPM, # MentionATrueFriend, # UKTVNeedsOutlander, # UDMu https://twitter.com/_TFB_TeamFollow/status/376217886345293824/photo/1pic.twitter.com/Qvy81DKoKM","GO=>ü¾Œ³ ¼ ??FOLLOWME?IFOLLOWYOU      "
"13264","# AskJPM Thoughts about current financial system and what US Pres should do: http://www.youtube.com/watch?v=A3BHujm3cpY ƒ"," Thoughts about current financial system and what US Pres should do: ü¾Œ³ ¼"
"13265","# AskJPM You are aware that everybody hates you, right? You aren't? No. Oh. Ok."," You are aware that everybody hates you, right? You aren't? No. Oh. Ok."
"13266","Does Patrick Bateman still run robo-signings? # AskJPM","Does Patrick Bateman still run robo-signings? "
"13267","# AskJPM, why do you oppose regulation of banks , pay your ececs so much, charge high interest on creditcards, please tell us"," why do you oppose regulation of banks , pay your ececs so much, charge high interest on creditcards, please tell us"
"13268","If you need some hilarity, you might want to check out # AskJPM","If you need some hilarity, you might want to check out "
"13269","For feinschmeckere innen finans, sosiale medier og LOL er # askJPM hashtaggen Î fÀlge i kveld. For en PR-smell. Hva tenkte de?","For feinschmeckere innen finans, sosiale medier og LOL er  hashtaggen ü¾™–Œ¼ fü¾Œ†Œ¼lge i kveld. For en PR-smell. Hva tenkte de?"
"13270","Why would you never agree to launder my drug money but you do it for the big guys? # AskJPM # smallbusiness","Why would you never agree to launder my drug money but you do it for the big guys?  "
"13271","When making hiring decisions, is yo firm accepting of regulator abusers and mad Buddha users? # AskJPM","When making hiring decisions, is yo firm accepting of regulator abusers and mad Buddha users? "
"13272","One reason I'm glad I restarted Twitter: watching the disasters of such things as # AskBG # AskBoris and tonight the epic # AskJPM","One reason I'm glad I restarted Twitter: watching the disasters of such things as   and tonight the epic "
"13273","Oh oh @ SconsetCapital: Have you accepted Jesus Christ as your personal savior? # AskJPMî","Oh oh  Have you accepted Jesus Christ as your personal savior? "
"13274","How many SEC agents does it take to mow Dimon's lawn? # AskJPM","How many SEC agents does it take to mow Dimon's lawn? "
"13275","DID YOU ORDER THE CODE RED??? # AskJPM","DID YOU ORDER THE CODE RED??? "
"13276","Can I have a job please? # AskJPM","Can I have a job please? "
"13277","What would you even DO with all the money. Have you thought this through? I don't think you have. # AskJPM","What would you even DO with all the money. Have you thought this through? I don't think you have. "
"13278","# AskJPM why did teslas funding stop? Oh yeah your a greedy fuck...."," why did teslas funding stop? Oh yeah your a greedy fuck...."
"13279","Jamie Dimon must be praying for a fail Whale now! # AskJPM","Jamie Dimon must be praying for a fail Whale now! "
"13280","Is the # AskJPM program another example of how $ JPM is the best managed bank on the planet?","Is the  program another example of how $ JPM is the best managed bank on the planet?"
"13281","Will you build your next office space in a forest so when you commit crimes, hopefully no one hears them? # AskJPM","Will you build your next office space in a forest so when you commit crimes, hopefully no one hears them? "
"13282","Maybe a half-step late to the party, but @ davidgaffen is winning # AskJPM by my count.","Maybe a half-step late to the party, but  is winning  by my count."
"13283","ñ@stevenperlberg: Is this the media coverage you were hoping for? # AskJPM http://www.businessinsider.com/trolls-take-over-ask-jpm-2013-11 ƒî","ü¾Œ–˜¼ Is this the media coverage you were hoping for?  ü¾Œ³ ¼ü¾™–”¼"
"13284","What happened to J. Corzine after his Waletrade? # askjpm","What happened to J. Corzine after his Waletrade? "
"13285","Have you accepted Jesus Christ as your personal savior? # AskJPM","Have you accepted Jesus Christ as your personal savior? "
"13286","# AskJPM why deposits are termed liabilities by the depositor? B/c your money becomes their money."," why deposits are termed liabilities by the depositor? B/c your money becomes their money."
"13287","Have any questions for J.P. Morgan? # AskJPM http://feedproxy.google.com/~r/Maxkeisercom/~3/8ipLI8OWXPM/ ƒ","Have any questions for J.P. Morgan?  ü¾Œ³ ¼"
"13288","Did you expect us? # AskJPM","Did you expect us? "
"13289","# AskJPM Who are you and where are you going? @ markgongloff"," Who are you and where are you going? "
"13290","# bongbong RT @ Wu_Tang_Finance: UOENO how to diversify yo bonds tho # AskJPM","   UOENO how to diversify yo bonds tho "
"13291","@ stephaniemick Word. See: http://www.theuptake.org/2013/10/29/dead-men-walking-vampires-march-against-jpmorgan-chase/ ƒ and http://www.kare11.com/news/article/1044328/14/Mpls-Vampire-March-demands-foreclosure-aid ƒ # AskJPM"," Word. See: ü¾Œ³ ¼ and ü¾Œ³ ¼ "
"13292","Follow the vile crimes of one of the biggest corrupt world banks at # AskJPM","Follow the vile crimes of one of the biggest corrupt world banks at "
"13293","RT @ JeanineSko: I can't stop reading these # AskJPM tweets ... (Some NSFW)","  I can't stop reading these  tweets ... (Some NSFW)"
"13294","Is there a Scrooge McDuck style money pool somewhere in the office? # AskJPM pic.twitter.com/rAlIeej0Pu","Is there a Scrooge McDuck style money pool somewhere in the office?  pic.twitter.com/rAlIeej0Pu"
"13295","Does Eric Holder take one lump or two? # AskJPM","Does Eric Holder take one lump or two? "
"13296","Did you know 15 minutes could save you 15% or more on car insurance? # AskJPM","Did you know 15 minutes could save you 15% or more on car insurance? "
"13297","@ reformedbroker outdoing himself in his own personal # snarkpocalypse on # askJPM"," outdoing himself in his own personal  on "
"13298","Does Dimon just leave the money on the dresser after he visits Congress? # AskJPM","Does Dimon just leave the money on the dresser after he visits Congress? "
"13299","# AskJPM How did JPMorgan's Latest PR Stunt Blow Up In Its Face? http://feedly.com/k/HYUBE5"," How did JPMorgan's Latest PR Stunt Blow Up In Its Face? "
"13300","They comin for your bacon, bro MT @ ReformedBroker What power grabs are you planning to execute during next crisis you help to cause? # AskJPM","They comin for your bacon, bro MT  What power grabs are you planning to execute during next crisis you help to cause? "
"13301","Where did I leave my keys? # askJPM","Where did I leave my keys? "
"13302","At what point did Jaime Dimon to lie about the London Whale with a empest in a Teapot? # AskJPM","At what point did Jaime Dimon to lie about the London Whale with a empest in a Teapot? "
"13303","# citizenradio maniacs should totally check out the # AskJPM hashtag out! @ ManiacWrangler @ ZJDSumo @ allisonkilkenny"," maniacs should totally check out the  hashtag out!   "
"13304","# AskJPM Have you called Saul Goodman yet?"," Have you called Saul Goodman yet?"
"13305","Is ertical integration another name for complete incoherence? ~ Asking for a friend who wants to start a big bank. # AskJPM","Is ertical integration another name for complete incoherence? ~ Asking for a friend who wants to start a big bank. "
"13306","It's a new ballgame for @ jpmorgan. Maybe you wanted trolls, well you got it. RT @ Wu_Tang_Finance UOENO how to diversify yo bonds tho # AskJPM","It's a new ballgame for  Maybe you wanted trolls, well you got it.   UOENO how to diversify yo bonds tho "
"13307","Did it ever occur to you that the world would be better if you didn't exist? # AskJPM","Did it ever occur to you that the world would be better if you didn't exist? "
"13308","# AskJPM Rob Ford, embattled Toronto mayor, admits he has bought illegal drugs - CBS News http://adf.ly/ZGw9Y"," Rob Ford, embattled Toronto mayor, admits he has bought illegal drugs - CBS News "
"13309","How much wood would a woodchuck chuck if a woodchuck could chuck wood? # AskJPM","How much wood would a woodchuck chuck if a woodchuck could chuck wood? "
"13310","# AskJPM http://makemoneyadf.bugs3.com?cgienpm2bjo14530makemoneyadf.bugs3.com/?cgienpm2bjo14 ƒ # RETWEET THIS! FOLLOW ME AND EVERYONE ELSE THAT RETWEETS THIS TO GAIN 50+ FOLLOWERS"," ü¾Œ³ ¼  THIS! FOLLOW ME AND EVERYONE ELSE THAT RETWEETS THIS TO GAIN 50+ FOLLOWERS"
"13311","Wow what a dumb idea. This is brilliant # askjpm","Wow what a dumb idea. This is brilliant "
"13312","What does Marcellus Wallace look like? # AskJPM","What does Marcellus Wallace look like? "
"13313","# AskJPM why they suddenly put limits on deposit/withD's or transfer of 50k/day. Bank run looming??"," why they suddenly put limits on deposit/withD's or transfer of 50k/day. Bank run looming??"
"13314","What is the average air speed velocity of an unladen swallow? # AskJPM","What is the average air speed velocity of an unladen swallow? "
"13315","If you're looking for a little light entertainment this Thursday morning i suggest you have a look at ---> # askJPM # ausbiz","If you're looking for a little light entertainment this Thursday morning i suggest you have a look at --->  "
"13316","Do you like Huey Lewis and The News? Or was their early work a little too new wave for your tastes? # AskJPM","Do you like Huey Lewis and The News? Or was their early work a little too new wave for your tastes? "
"13317","Death? Or exile? # AskJPM","Death? Or exile? "
"13318","# AskJPM are you worried what people will say when they see the silver manipulation evidence that the CFTC ignored?"," are you worried what people will say when they see the silver manipulation evidence that the CFTC ignored?"
"13319","# AskJPM This poking of the bear has been brought to you by a group of people too disconnected with reality to see what really matters."," This poking of the bear has been brought to you by a group of people too disconnected with reality to see what really matters."
"13320","Is there an income ceiling beyond which it's no longer fun to screw somebody? # AskJPM","Is there an income ceiling beyond which it's no longer fun to screw somebody? "
"13321","RT @ zerohedge How # JPMorgan's Latest PR Stunt Blew Up In Its Face! http://www.zerohedge.com/news/2013-11-13/how-jpmorgans-latest-pr-stunt-blew-its-face ƒ # AskJPM","  How  Latest PR Stunt Blew Up In Its Face! ü¾Œ³ ¼ "
"13322","omfg @ jpmorgan RT @occupyphoenix Do you feel like your all encompassing shenanigans are overlooked b/c @ GoldmanSachs is more hated? # AskJPM","omfg    Do you feel like your all encompassing shenanigans are overlooked b/c  is more hated? "
"13323","Q: When did you stop beating your wife? # AskJPM","Q: When did you stop beating your wife? "
"13324","i know the fact that you just push around enormous amounts of money all day makes you awesomer than me. but *how much* awesomer? # askJPM","i know the fact that you just push around enormous amounts of money all day makes you awesomer than me. but *how much* awesomer? "
"13325","# AskJPM about Bretton Woods, first ask yourself about Bretton Woods."," about Bretton Woods, first ask yourself about Bretton Woods."
"13326","Boy, that escalated quickly. # AskJPM http://25.media.tumblr.com/tumblr_m8l60jLcij1ra5p9wo1_500.gif ƒ","Boy, that escalated quickly.  ü¾Œ³ ¼"
"13327","ñ @ ReformedBroker: What power grabs are you planning to execute during the next financial crisis you help to cause? # AskJPMî","ü¾Œ–˜¼  What power grabs are you planning to execute during the next financial crisis you help to cause? "
"13328","How many times a year do bonds pay interest again? # AskJPM","How many times a year do bonds pay interest again? "
"13329","Remember that one time you onated $4M+ to NYPD and then # ows got removed from the park? We do!! @ OccupyWallSt # AskJPM # ows","Remember that one time you onated $4M+ to NYPD and then  got removed from the park? We do!!   "
"13330","is your thievery department hiring? # AskJPM","is your thievery department hiring? "
"13331","The # AskJPM debacle brings up a variant of a question I've been asking for a while: Does a bank really need to be active on social media?","The  debacle brings up a variant of a question I've been asking for a while: Does a bank really need to be active on social media?"
"13332","# AskJPM how they've gotten fat on our demise. # fractionalreservebanking"," how they've gotten fat on our demise. "
"13333","Could you please back-edit this JPMorgan Shame Tracker for us? https://infogr.am/JPM-Shame-Tracker ƒ # AskJPM","Could you please back-edit this JPMorgan Shame Tracker for us? ü¾Œ³ ¼ "
"13334","GO=>http://www.linklite.info/followcrazy?Kt1gu2yvLU&PHlindinho1 ƒ ?RT?FOLLOWME?IFOLLOWYOU # CookieDance, # AskJPM, # MentionATrueFriend, # UKTVNeedsOutlander, # UDMu https://twitter.com/_TFB_TeamFollow/status/376217886345293824/photo/1pic.twitter.com/Qvy81DKoKM","GO=>ü¾Œ³ ¼ ??FOLLOWME?IFOLLOWYOU      "
"13335","Will you use the same types of shitty derivatives for student loans that you did for mortgages, or do you plan to unveil new ones? # AskJPM","Will you use the same types of shitty derivatives for student loans that you did for mortgages, or do you plan to unveil new ones? "
"13336","What is my debit card PIN again? # AskJPM","What is my debit card PIN again? "
"13337","yes yes yes & yes to the # AskJPM tweets","yes yes yes & yes to the  tweets"
"13338","If I don't like eating cake, is a lightly toasted brioche an acceptable substitute? # AskJPM # FrenchhistoryLOLZ","If I don't like eating cake, is a lightly toasted brioche an acceptable substitute?  "
"13339","On this MortgageFraud case I'm filing this week, do I use your NY address for my CrossClaim or is there a better one to use? Thanks! # askJPM","On this MortgageFraud case I'm filing this week, do I use your NY address for my CrossClaim or is there a better one to use? Thanks! "
"13340","How many lives have you destroyed? # AskJPM","How many lives have you destroyed? "
"13341","I can't stop reading these # AskJPM tweets ...","I can't stop reading these  tweets ..."
"13342","# AskJPM how the silver manipulation is going."," how the silver manipulation is going."
"13343","# AskJPM will forever turn banks off social media."," will forever turn banks off social media."
"13344","I'd name him Iksil. RT @ matt_levine: Do you like puppies? If you had a puppy, what would you name him? # AskJPM","I'd name him Iksil.   Do you like puppies? If you had a puppy, what would you name him? "
"13345","Can we live in a world without mortgages, in which all who need housing, have it? # AskJPM","Can we live in a world without mortgages, in which all who need housing, have it? "
"13346","Are you laughing and thinking there's no such thing as bad social media exposure # askJPM","Are you laughing and thinking there's no such thing as bad social media exposure "
"13347","Can I borrow a dollar? # AskJPM","Can I borrow a dollar? "
"13348","ñ @ Wu_Tang_Finance: UOENO how to diversify yo bonds tho # AskJPMî @ KyleSyptak","ü¾Œ–˜¼  UOENO how to diversify yo bonds tho  "
"13349","oh boy, ow not to do twitter PR 101 @ helaineolen RT @ timmyconspiracy: How many puppies have you murdered today? # AskJPM","oh boy, ow not to do twitter PR 101    How many puppies have you murdered today? "
"13350","Trend Alert: # AskJPM. More trends at http://www.trendinalia.com/twitter-trending-topics/usa/newyork-today.html ƒ # trndnlpic.twitter.com/jWW5H2WvYH","Trend Alert:  More trends at ü¾Œ³ ¼ "
"13351","# AskJPM what brand of champagne were you drinking when you ridiculed # OccupyWallStreet from your balcony?"," what brand of champagne were you drinking when you ridiculed  from your balcony?"
"13352","# AskJPM is trending No. 1! Which leads me to ask: Is Dimon a girl's best friend?"," is trending No. 1! Which leads me to ask: Is Dimon a girl's best friend?"
"13353","Q: So who's idea was it to go with # AskJPM and Jimmy Lee instead of Jamie Dimon in a carnival dunking booth on Park Avenue?","Q: So who's idea was it to go with  and Jimmy Lee instead of Jamie Dimon in a carnival dunking booth on Park Avenue?"
"13354","Can we live in a world without fees and debt? # AskJPM # WWJD","Can we live in a world without fees and debt?  "
"13355","# AskJPM How many jailed bankers does it take to change a lightbulb? # careeradvice http://is.gd/6q6chu"," How many jailed bankers does it take to change a lightbulb?  "
"13356","So, how long until the next # AskJPM? I'm thinking never.","So, how long until the next  I'm thinking never."
"13357","# AskJPM # BestHashTagEver"," "
"13358","Is Jamie Dimon 'too big to fail' (if you know what I mean... and I think that you do)? # AskJPM","Is Jamie Dimon 'too big to fail' (if you know what I mean... and I think that you do)? "
