"","jpm$text","text_clean"
"13359","Seriously, seriously, why does any remotely controversial organization think twitter chats are a good idea. # AskJPM","Seriously, seriously, why does any remotely controversial organization think twitter chats are a good idea. "
"13360","Is this turning into another empest in a teacup? # AskJPM","Is this turning into another empest in a teacup? "
"13361","Can we live in a world without fees and debt? # AskJPM","Can we live in a world without fees and debt? "
"13362","How many new media companies do you think are compiling a 'best of' collection of tweets right now? # AskJPM","How many new media companies do you think are compiling a 'best of' collection of tweets right now? "
"13363","As a young sociopath, how can I succeed in finance? # AskJPM","As a young sociopath, how can I succeed in finance? "
"13364","If you could have a superpower, would you want to fly, be invisible or magically avoid prosecution again and again?! # AskJPM","If you could have a superpower, would you want to fly, be invisible or magically avoid prosecution again and again?! "
"13365","The DOJ is hiring. How many? # AskJPM","The DOJ is hiring. How many? "
"13366","Who gets the shown the door for this---> # AskJPM","Who gets the shown the door for this---> "
"13367","# AskJPM One time you thought you were to big to fail. This second time do you really think you are oo big to jail?;;;#;00747613756329984;https://twitter.com/KLinLA/status/400747613756329984"," One time you thought you were to big to fail. This second time do you really think you are oo big to jail?;;;"
"13368","Do you notch your belt or your suspenders every time you score on another regulatory capture? # AskJPM","Do you notch your belt or your suspenders every time you score on another regulatory capture? "
"13369","Okay, I'm beginning to feel just a *tiny* bit bad for Jimmy Lee here, which is saying a lot for me. But I am a banker. # AskJPM","Okay, I'm beginning to feel just a *tiny* bit bad for Jimmy Lee here, which is saying a lot for me. But I am a banker. "
"13370","@ jpmorgan how many jobs did you outsource in favor of your golden toilets and more financial crimes being committed # AskJPM"," how many jobs did you outsource in favor of your golden toilets and more financial crimes being committed "
"13371","If you haven't read the # askJPM tweets, you are really missing out. Social media at its finest/worse/snarkiest.","If you haven't read the  tweets, you are really missing out. Social media at its finest/worse/snarkiest."
"13372","How does it feel to now be considered worse than a vampire squid? # AskJPM","How does it feel to now be considered worse than a vampire squid? "
"13373","So the # AskJPM hashtag is responsible for grinding the productivity of dozens of financial reporters to a complete stop.","So the  hashtag is responsible for grinding the productivity of dozens of financial reporters to a complete stop."
"13374","JPMorgan is asking people to send in questions on twitter using hashtag # AskJPM. Please feel free to hash tag away. via Occupy Miami","JPMorgan is asking people to send in questions on twitter using hashtag  Please feel free to hash tag away. via Occupy Miami"
"13375","GO=>http://www.linklite.info/followcrazy?E3tJk0ojwh&PHlindinho1 ƒ ?RT?FOLLOWME?IFOLLOWYOU # CookieDance, # AskJPM, # MentionATrueFriend, # UKTVNeedsOutlander, # UDMu https://twitter.com/_TFB_TeamFollow/status/376217886345293824/photo/1pic.twitter.com/Qvy81DKoKM","GO=>ü¾Œ³ ¼ ??FOLLOWME?IFOLLOWYOU      "
"13376","UOENO how to diversify yo bonds tho # AskJPM","UOENO how to diversify yo bonds tho "
"13377","KY or Vaseline? # AskJPM","KY or Vaseline? "
"13378","@ alexisgoldstein Stupid Q. # AskJPM doesn't need your human beds. They rest in vats of virgins' tears recharging their contempt."," Stupid Q.  doesn't need your human beds. They rest in vats of virgins' tears recharging their contempt."
"13379","@ pareene maybe that's a question for # AskJPM. How close are you to handing over $9 billion or so for lying about quality of bonds you sold?"," maybe that's a question for  How close are you to handing over $9 billion or so for lying about quality of bonds you sold?"
"13380","@ d_seaman also check out the # AskJPM feed! :)"," also check out the  feed! :)"
"13381","it's making me feel good about humanity RT @ jgreendc: The # AskJPM hashtag is an absolute delight","it's making me feel good about humanity   The  hashtag is an absolute delight"
"13382","Carpe meum? :) RT @ ReformedBroker: What power grabs are you planning to execute during the next financial crisis you help to cause? # AskJPM","Carpe meum? :)   What power grabs are you planning to execute during the next financial crisis you help to cause? "
"13383","# AskJPM why don't you fuck off?"," why don't you fuck off?"
"13384","JP Morgan thought Bernie Madoff was a good bet at $200 million, a month before he got caught. Can we trust its judgment? # AskJPM","JP Morgan thought Bernie Madoff was a good bet at $200 million, a month before he got caught. Can we trust its judgment? "
"13385","Wow... who thought # AskJPM would be a good idea? On the flip side reading the tweets is hilarious.","Wow... who thought  would be a good idea? On the flip side reading the tweets is hilarious."
"13386","Will # AskJPM force @ tomgara to use a hashtag?","Will  force  to use a hashtag?"
"13387","RT: @ shannybasar Are you already imagining the @ BuzzFeed story about the # AskJPM tweets ?",":  Are you already imagining the  story about the  tweets ?"
"13388","Echando un ojo a # AskJPM donde los tuiteros preguntan a JPMorgan","Echando un ojo a  donde los tuiteros preguntan a JPMorgan"
"13389","What power grabs are you planning to execute during the next financial crisis you help to cause? # AskJPM","What power grabs are you planning to execute during the next financial crisis you help to cause? "
"13390","# AskJPM hashtag on twitter made my day"," hashtag on twitter made my day"
"13391","Shallow grave or 55 gallon drum? # AskJPM","Shallow grave or 55 gallon drum? "
"13392","Does Tony Blair still work for, or get paid by, JPMorgan Chase? For what, exactly? http://www.innercitypress.com/unblairchase011008.html ƒ # AskJPM","Does Tony Blair still work for, or get paid by, JPMorgan Chase? For what, exactly? ü¾Œ³ ¼ "
"13393","How are you planning to spend the savings made from firing your social media team? # askJPM","How are you planning to spend the savings made from firing your social media team? "
"13394","Will your social media PR person get fired? ñ @ zerohedge: How JPMorgan's Latest PR Stunt Blew Up In Its Face http://tinyurl.com/pkldg5x î # AskJPM","Will your social media PR person get fired? ü¾Œ–˜¼  How JPMorgan's Latest PR Stunt Blew Up In Its Face ü¾™–”¼ "
"13395","What does the fox say? # AskJPM","What does the fox say? "
"13396","Will Josh (TRB) ever RT me? # AskJPM","Will Josh (TRB) ever  me? "
"13397","Must work. But # AskJPM feed: Too delicious.","Must work. But  feed: Too delicious."
"13398","Do you feel like your all encompassing shenanigans are overlooked because Goldman Sachs is more hated? # AskJPM","Do you feel like your all encompassing shenanigans are overlooked because Goldman Sachs is more hated? "
"13399","Does CEO Jamie Dimon always laugh in front of congress when he loses hundreds of millions of dollars? # AskJPM","Does CEO Jamie Dimon always laugh in front of congress when he loses hundreds of millions of dollars? "
"13400","Loving the amount of # snark brought on by # AskJPM As awful as they are, the questions are making my day.","Loving the amount of  brought on by  As awful as they are, the questions are making my day."
"13401","Did you guys seriously expect to have any non-ironic questions made with this HT? # askJPM","Did you guys seriously expect to have any non-ironic questions made with this HT? "
"13402","You do realize you're not being compensated for your talent, yes? You're just the dumb Ivy legacy kids burning other people's money. # AskJPM","You do realize you're not being compensated for your talent, yes? You're just the dumb Ivy legacy kids burning other people's money. "
"13403","This is getting ugly... RT @ amy10506: Are SEC regulators good in bed or do they just kinda lie there? # AskJPM","This is getting ugly...   Are SEC regulators good in bed or do they just kinda lie there? "
"13404","@ ILLUMlNATI # AskJPM?"," "
"13405","Gawker, BuzzFeed, and Business Insider must've gotten together and asked themselves, hat would be the best viral meme ever?: # AskJPM","Gawker, BuzzFeed, and Business Insider must've gotten together and asked themselves, hat would be the best viral meme ever?: "
"13406","# AskJPM I heard you have sudden openings in your PR department. I would apply if I wasn't so inconveniently burdened by morality."," I heard you have sudden openings in your PR department. I would apply if I wasn't so inconveniently burdened by morality."
"13407","Are you already imagining the @ BuzzFeed story about the # AskJPM tweets ?","Are you already imagining the  story about the  tweets ?"
"13408","Have you been practicing getting a camel through the eye of a needle? # AskJPM","Have you been practicing getting a camel through the eye of a needle? "
"13409","@ kevinroose Securitization. # AskJPM"," Securitization. "
"13410","RT @ ABWashBureau Given the unqualified success of # AskJPM,really looking forward to # AskBofA, # AskCiti and # AskWells. Should be any day now.","  Given the unqualified success of  looking forward to   and  Should be any day now."
"13411","I came here to bitch about Jared Diamond not Jamie Dimon. are they the same guy? # askJPM","I came here to bitch about Jared Diamond not Jamie Dimon. are they the same guy? "
"13412","What is yo opinion of Smith Barney? # AskJPM","What is yo opinion of Smith Barney? "
"13413","Have any questions for J.P. Morgan? # AskJPM http://feedproxy.google.com/~r/Maxkeisercom/~3/8ipLI8OWXPM/ ƒ","Have any questions for J.P. Morgan?  ü¾Œ³ ¼"
"13414","Enjoy catching up with the DOJ team during your settlement negotiations? http://blog.littlesis.org/2013/10/23/jpmorgan-negotiates-through-the-revolving-door/ ƒ # AskJPM pic.twitter.com/ndkwYQujNJ","Enjoy catching up with the DOJ team during your settlement negotiations? ü¾Œ³ ¼  pic.twitter.com/ndkwYQujNJ"
"13415","Must clarify: my @ alexisgoldstein RT is just my fave example of # AskJPM going off the rails...","Must clarify: my   is just my fave example of  going off the rails..."
"13416","Are SEC regulators good in bed or do they just kinda lie there? # AskJPM","Are SEC regulators good in bed or do they just kinda lie there? "
"13417","RT @ ABWashBureau: Given the unqualified success of # AskJPM, I'm really looking forward to # AskBofA, # AskCiti and # AskWells. Should be any...","  Given the unqualified success of  I'm really looking forward to   and  Should be any..."
"13418","How much extra cash do you earn by debiting accounts a day earlier than the actual payment date set on Chase Online BillPay? $1tr? # AskJPM","How much extra cash do you earn by debiting accounts a day earlier than the actual payment date set on Chase Online BillPay? $1tr? "
"13419","I have Mortgage Fraud, Market Manipulation, Credit Card Abuse, Libor Rigging and Predatory Lending AM I DIVERSIFIED? # AskJPM","I have Mortgage Fraud, Market Manipulation, Credit Card Abuse, Libor Rigging and Predatory Lending AM I DIVERSIFIED? "
"13420","Does Jamie Dimon pet a small cat and laugh ominously while he's ruining poor people's lives? # AskJPM","Does Jamie Dimon pet a small cat and laugh ominously while he's ruining poor people's lives? "
"13421","Would you rather live in the descendency of a civilization or evict a cancer riddled woman out of her home? # AskJPM","Would you rather live in the descendency of a civilization or evict a cancer riddled woman out of her home? "
"13422","# AskJPM: Giving reasons why marketing doesn't really work on Twitter since 2013"," Giving reasons why marketing doesn't really work on Twitter since 2013"
"13423","Volg # AskJPM (ja, stel je vragen aan JPMorgan Chase) en je lacht je helemaal slap. Hier voorbeeldje: https://twitter.com/amy10506/status/400736898835947520 ƒ # AEX","Volg  (ja, stel je vragen aan JPMorgan Chase) en je lacht je helemaal slap. Hier voorbeeldje: ü¾Œ³ ¼ "
"13424","@ kevinroose @ taralach How do you say Oy Vey in banking-speak? # AskJPM","  How do you say Oy Vey in banking-speak? "
"13425","ñ @ ObsoleteDogma: What's your favorite type of whale? # AskJPMî looks like this will be as successful as British Gas attempt at social media","ü¾Œ–˜¼  What's your favorite type of whale?  looks like this will be as successful as British Gas attempt at social media"
"13426","Social media malpractice. RT @ rachelsedelman: If you feel like a failure, imagine being the person who came up with # AskJPM","Social media malpractice.   If you feel like a failure, imagine being the person who came up with "
"13427","This was the first 1 I saw cc: @ evanmcmurry @bySamRo RT @ EddyElfenbein: What's the best way to get blood stains out of a clown suit? # AskJPM","This was the first 1 I saw cc:     What's the best way to get blood stains out of a clown suit? "
"13428","RT @ alexisgoldstein # AskJPM when you had to pay $100M to @ CFTC for credit mkt manipulation, were you like, kt making IS manipulation!","   when you had to pay $100M to  for credit mkt manipulation, were you like, kt making IS manipulation!"
"13429","why would @ jpmorgan go with the vice chairman when they could have the narc chairman # askjpm","why would  go with the vice chairman when they could have the narc chairman "
"13430","Body of an eagle, head of a bear # JackDonaghyftw RT @ SconsetCapital: If you could be any kind of animal, what would you be? # AskJPM","Body of an eagle, head of a bear    If you could be any kind of animal, what would you be? "
"13431","Oh, Oh, Oh! I forgot to ask in that last Q. What's it like applying leeches for a living? # AskJPM","Oh, Oh, Oh! I forgot to ask in that last Q. What's it like applying leeches for a living? "
"13432","# AskJPM: When screwing the devil, are you a top or a bottom? Were you playing ust the tip this time?"," When screwing the devil, are you a top or a bottom? Were you playing ust the tip this time?"
"13433","Whale you be my Valentine? # AskJPM","Whale you be my Valentine? "
"13434","You, Anthony of course. RT @ AntDeRosa: Why do teens love @ Circa? # AskJPM","You, Anthony of course.   Why do teens love  "
"13435","To foreclose or not to foreclose, that is the question. # AskJPM # WhyBotherAskingTheAnswerIsAlwaysToForeclose","To foreclose or not to foreclose, that is the question.  "
"13436","Blondes or Brunettes? # AskJPM","Blondes or Brunettes? "
"13437","Pretty sure # askJPM is the busiest hashtag over the last 10 minutes.... And it's hilarious.","Pretty sure  is the busiest hashtag over the last 10 minutes.... And it's hilarious."
"13438","Do you ever feel terrible about your crimes and utter lack of social utility? If so, do you buy something, snort something, or both? # AskJPM","Do you ever feel terrible about your crimes and utter lack of social utility? If so, do you buy something, snort something, or both? "
"13439","Yes. I do have a question. Who is in charge of your marketing? # AskJPM","Yes. I do have a question. Who is in charge of your marketing? "
"13440","Tumbler or Grinder? # AskJPM","Tumbler or Grinder? "
"13441","Have you started selling derivatives based on leases in the slums you've created and are now buying up? # AskJPM","Have you started selling derivatives based on leases in the slums you've created and are now buying up? "
"13442","Given the unqualified success of # AskJPM, I'm really looking forward to # AskBofA, # AskCiti and # AskWells. Should be any day now.","Given the unqualified success of  I'm really looking forward to   and  Should be any day now."
"13443","Would you say that your absurd disregard for long-term profits in favor of short-term illusory growth is evil, or just stupid? # AskJPM","Would you say that your absurd disregard for long-term profits in favor of short-term illusory growth is evil, or just stupid? "
"13444","Have you ever seen the rain? # AskJPM","Have you ever seen the rain? "
"13445","RT @corpounreal: # AskJPM Do you not realize the vast majority of Americans know you are criminals, know ... http://m.tmi.me/1ca6Mf","   Do you not realize the vast majority of Americans know you are criminals, know ... "
"13446","Suck it? # AskJPM","Suck it? "
"13447","Did Ken Rogoff do any consulting work for you? # AskJPM","Did Ken Rogoff do any consulting work for you? "
"13448","Boxers or briefs? # AskJPM","Boxers or briefs? "
"13449","If you could be any kind of animal, what would you be? # AskJPM","If you could be any kind of animal, what would you be? "
"13450","# AskJPM How do you feel about Libor style currency manipulation? http://m.rollingstone.com/politics/blogs/taibblog/chase-isnt-the-only-bank-in-trouble-20131105 ƒ"," How do you feel about Libor style currency manipulation? ü¾Œ³ ¼"
"13451","So, uh, got any gum? # AskJPM","So, uh, got any gum? "
"13452","@ allinwithchris @ chrislhayes I'm nominating the hashtag # AskJPM for the click 3 tonight. Seriously funny trolling. @ alexisgoldstein","  I'm nominating the hashtag  for the click 3 tonight. Seriously funny trolling. "
"13453","I just want to know what kind of questions the creators of # AskJPM thought they were going to get before the deluge of raw hate began.","I just want to know what kind of questions the creators of  thought they were going to get before the deluge of raw hate began."
"13454","Are you Christian? If so, did you know the Bible outlaws usury? # AskJPM","Are you Christian? If so, did you know the Bible outlaws usury? "
"13455","Would you say it was a great recession or the greatest recession? # AskJPM","Would you say it was a great recession or the greatest recession? "
"13456","Who is going to make the, est of # askJPM blog post","Who is going to make the, est of  blog post"
"13457","Who are you wearing? # AskJPM","Who are you wearing? "
"13458","Can you elp the FDA reconsider their decision on $ srpt? # AskJPM","Can you elp the FDA reconsider their decision on $ srpt? "
"13459","When will I be able to buy credit default swaps on the credit card accounts of people I know? # AskJPM","When will I be able to buy credit default swaps on the credit card accounts of people I know? "
"13460","Lloyd Blankfein and the entire executive suite are hunched over a first year analyst's twitter feed laughing their asses off over # AskJPM.","Lloyd Blankfein and the entire executive suite are hunched over a first year analyst's twitter feed laughing their asses off over "
"13461","What was Bernie Madoff like? # AskJPM","What was Bernie Madoff like? "
"13462","awesome -> ñ @ ReformedBroker: Ladies and Gentlemen, the Snarkpocalypse is upon us. Brought about by this: # AskJPMî","awesome -> ü¾Œ–˜¼  Ladies and Gentlemen, the Snarkpocalypse is upon us. Brought about by this: "
"13463","Who cuts your hair? # AskJPM","Who cuts your hair? "
"13464","At what point will you be accountable for your actions? # AskJPM # JPM","At what point will you be accountable for your actions?  "
"13465","What's your prefered instrument of torture for the ordinary serf, the ARM with a hidden balloon, or the variable rate CC? # AskJPM","What's your prefered instrument of torture for the ordinary serf, the ARM with a hidden balloon, or the variable rate CC? "
"13466","# AskJPM Are you guys aware that you still haven't hired brilliant analyst @ pzanitti? Don't let $ GS grab him first..."," Are you guys aware that you still haven't hired brilliant analyst  Don't let $ GS grab him first..."
"13467","What's your favorite type of whale? # AskJPM","What's your favorite type of whale? "
"13468","I got nothing. # AskJPM","I got nothing. "
"13469","# AskJPM Does your social media team really hate their jobs? Sad if UR only ones fired at JPM due to popular outrage at rampant criminality."," Does your social media team really hate their jobs? Sad if UR only ones fired at JPM due to popular outrage at rampant criminality."
"13470","How early do you guys get FED statements? # AskJPM","How early do you guys get FED statements? "
"13471","@ rgb920 # AskJPM"," "
"13472","# AskJPM Is it more difficult to sell toxic mortgages, engage in stock fraud, buy a politician or develop a conscience?"," Is it more difficult to sell toxic mortgages, engage in stock fraud, buy a politician or develop a conscience?"
"13473","How many dreams did you kill today? # AskJPM","How many dreams did you kill today? "
"13474","@ jpmorgan How far do you and your financial sector gang members think you can push things before you are driven off the continent? # AskJPM"," How far do you and your financial sector gang members think you can push things before you are driven off the continent? "
"13475","Paper or plastic? # AskJPM","Paper or plastic? "
"13476","Lonestar? RT @ jmaz: Didn't you think it would be a problem when you hired the Winnebago pilot from Spaceballs to be your CEO? # AskJPM","Lonestar?   Didn't you think it would be a problem when you hired the Winnebago pilot from Spaceballs to be your CEO? "
"13477","If you were a shameless financial predator profiting off of the misery of your customers, what kind of predator would you be? # AskJPM","If you were a shameless financial predator profiting off of the misery of your customers, what kind of predator would you be? "
"13478","Why do teens love @ Circa? # AskJPM","Why do teens love  "
"13479","OMG. JP Morgan's public relations department must feel like Custer's troops at the Little Big Horn. # AskJPM","OMG. JP Morgan's public relations department must feel like Custer's troops at the Little Big Horn. "
"13480","Didn't you think it would be a problem when you hired the Winnebago pilot from Spaceballs to be your CEO? # AskJPM","Didn't you think it would be a problem when you hired the Winnebago pilot from Spaceballs to be your CEO? "
"13481","Boxers or briefs? # AskJPM","Boxers or briefs? "
"13482","@ jpmorgan how would you say # askjpm is going out of ten"," how would you say  is going out of ten"
"13483","Is # AskJPM trending yet???","Is  trending yet???"
"13484","# AskJPM To what faults do you feel most indulgent?"," To what faults do you feel most indulgent?"
"13485","Can @ jpmorgan explain to me how itÍs in the interests of anyone to evict someone instead of renegotiating a mortgage? # askjpm","Can  explain to me how itü¾™†Œ¼s in the interests of anyone to evict someone instead of renegotiating a mortgage? "
"13486","What's your total derivative exposure? http://seekingalpha.com/article/301260-bank-of-america-dumps-75-trillion-in-derivatives-on-u-s-taxpayers-with-federal-approval ƒ # AskJPM","What's your total derivative exposure? ü¾Œ³ ¼ "
"13487","When will I be able to buy securities backed by ppl's disability payments that they give to JG Wentworth in exchange for cash now? # AskJPM","When will I be able to buy securities backed by ppl's disability payments that they give to JG Wentworth in exchange for cash now? "
"13488","Hey @ wilw @ jpmorgan wants people to send them questions using hashtag # AskJPM! Got any doozies? Did they finance The Phantom Menace? ;)","Hey   wants people to send them questions using hashtag  Got any doozies? Did they finance The Phantom Menace? ;)"
"13489","Oh, # AskJPM , never change.","Oh,  , never change."
"13490","I laughed. I cried. RT @ EddyElfenbein: What's the best way to get blood stains out of a clown suit? # AskJPM","I laughed. I cried.   What's the best way to get blood stains out of a clown suit? "
"13491","If you are in need of a chuckle, check out # AskJPM Yup, it was the brainchild of some soon to be former JPMorgan employee.","If you are in need of a chuckle, check out  Yup, it was the brainchild of some soon to be former JPMorgan employee."
"13492","Will the Fed taper in March? # askJPM","Will the Fed taper in March? "
"13493","Do you have any deliverable gold left? # AskJPM","Do you have any deliverable gold left? "
"13494","These are the last 4 # askJPM comments that I saw come through: http://stks.co/gv4Z","These are the last 4  comments that I saw come through: "
"13495","The fountainhead or Atlas Shrugged? # AskJPM","The fountainhead or Atlas Shrugged? "
"13496","RT @ EddyElfenbein: What's the best way to get blood stains out of a clown suit? # AskJPM","  What's the best way to get blood stains out of a clown suit? "
"13497","Corzine walking. RT @ retheauditors: # AskJPM What do you regard as the lowest depth of misery?","Corzine walking.    What do you regard as the lowest depth of misery?"
"13498","How much ground could a groundhog hog if a groundhog could hog ground? # AskJPM","How much ground could a groundhog hog if a groundhog could hog ground? "
"13499","What's the best way to get blood stains out of a clown suit? # AskJPM","What's the best way to get blood stains out of a clown suit? "
"13500","@ OccupyWallSt I'm giving them many of # my2cents. @ jpmorgan is a community destroying, bloodsucker just # AskJPM # jailbankers"," I'm giving them many of   is a community destroying, bloodsucker just  "
"13501","Is your hief Compliance Officer alive? Has anyone checked to see if he's in his office? # AskJPM","Is your hief Compliance Officer alive? Has anyone checked to see if he's in his office? "
"13502","# AskJPM What do you regard as the lowest depth of misery?"," What do you regard as the lowest depth of misery?"
"13503","Did you always want to be part of a vast, corrupt criminal enterprise or did you reak bad? # AskJPM","Did you always want to be part of a vast, corrupt criminal enterprise or did you reak bad? "
